{
  "version": 1,
  "authorityMode": "hand-written-canonical-ui-drive-identities",
  "surfaceIds": [
    "windows-desktop-application",
    "documentation-site"
  ],
  "featureIds": [
    "language-modes",
    "dialog-emoji-toggle",
    "school-mode",
    "narration",
    "scheduled-settings",
    "dim-sum-surprise",
    "regex-builders",
    "notification-centre",
    "appearance-editors",
    "tabbed-navigation",
    "offline-documentation",
    "command-palette",
    "destructive-confirmation",
    "local-history",
    "changelog-viewer",
    "external-editor",
    "exports",
    "bulk-actions",
    "accessibility-responsive-sizing",
    "personal-vocabulary-upload",
    "toy-locks-authentication",
    "unlock-ladder",
    "shared-link-embed",
    "adhd-modes",
    "browser-download-surfaces",
    "app-logo-customization",
    "file-converter",
    "ollama-suite-manager",
    "status-hub",
    "front-screen-provenance"
  ],
  "destinationIds": [
    "home-default-light",
    "projects-default-light",
    "design-systems-default-light",
    "automations-default-light",
    "plugins-default-light",
    "integrations-default-light",
    "studio-default-light",
    "library-default-light",
    "settings-appearance-light",
    "handoff-default-light"
  ],
  "sceneIds": [
    "scene-windows-desktop-application-language-modes-change-language-mode",
    "scene-windows-desktop-application-dialog-emoji-toggle-toggle-dialog-emojis",
    "scene-windows-desktop-application-school-mode-enable-school-mode",
    "scene-windows-desktop-application-narration-enable-narrator",
    "scene-windows-desktop-application-scheduled-settings-create-schedule",
    "scene-windows-desktop-application-dim-sum-surprise-observe-startup-surprise",
    "scene-windows-desktop-application-regex-builders-open-anchored-regex-builder",
    "scene-windows-desktop-application-notification-centre-open-notification-centre",
    "scene-windows-desktop-application-appearance-editors-edit-element-appearance",
    "scene-windows-desktop-application-tabbed-navigation-open-tab-context-menu",
    "scene-windows-desktop-application-offline-documentation-open-offline-documentation",
    "scene-windows-desktop-application-command-palette-open-command-palette",
    "scene-windows-desktop-application-destructive-confirmation-open-destructive-confirmation",
    "scene-windows-desktop-application-local-history-open-local-history",
    "scene-windows-desktop-application-changelog-viewer-open-changelog-viewer",
    "scene-windows-desktop-application-external-editor-open-export-in-editor",
    "scene-windows-desktop-application-exports-open-export-catalog",
    "scene-windows-desktop-application-bulk-actions-select-bulk-range",
    "scene-windows-desktop-application-accessibility-responsive-sizing-exercise-keyboard-focus",
    "scene-windows-desktop-application-personal-vocabulary-upload-open-vocabulary-picker",
    "scene-windows-desktop-application-toy-locks-authentication-activate-disabled-locked-element",
    "scene-windows-desktop-application-unlock-ladder-start-unlock-ladder",
    "scene-windows-desktop-application-shared-link-embed-inspect-shared-link-preview",
    "scene-windows-desktop-application-adhd-modes-enable-focus-mode",
    "scene-windows-desktop-application-browser-download-surfaces-confirm-captured-download",
    "scene-windows-desktop-application-app-logo-customization-select-logo-preset",
    "scene-windows-desktop-application-file-converter-open-converter-catalog",
    "scene-windows-desktop-application-ollama-suite-manager-open-model-store",
    "scene-windows-desktop-application-status-hub-open-status-hub",
    "scene-windows-desktop-application-front-screen-provenance-observe-front-screen-provenance",
    "scene-windows-desktop-application-destination-home-default-light",
    "scene-windows-desktop-application-destination-projects-default-light",
    "scene-windows-desktop-application-destination-design-systems-default-light",
    "scene-windows-desktop-application-destination-automations-default-light",
    "scene-windows-desktop-application-destination-plugins-default-light",
    "scene-windows-desktop-application-destination-integrations-default-light",
    "scene-windows-desktop-application-destination-studio-default-light",
    "scene-windows-desktop-application-destination-library-default-light",
    "scene-windows-desktop-application-destination-settings-appearance-light",
    "scene-windows-desktop-application-destination-handoff-default-light",
    "scene-documentation-site-language-modes-site-change-language-mode",
    "scene-documentation-site-dialog-emoji-toggle-site-toggle-dialog-emojis",
    "scene-documentation-site-school-mode-site-enable-school-mode",
    "scene-documentation-site-narration-site-enable-narrator",
    "scene-documentation-site-scheduled-settings-site-create-schedule",
    "scene-documentation-site-dim-sum-surprise-site-observe-startup-surprise",
    "scene-documentation-site-regex-builders-site-open-anchored-regex-builder",
    "scene-documentation-site-notification-centre-site-open-notification-centre",
    "scene-documentation-site-appearance-editors-site-edit-element-appearance",
    "scene-documentation-site-tabbed-navigation-site-open-tab-context-menu",
    "scene-documentation-site-offline-documentation-site-open-feature-article",
    "scene-documentation-site-command-palette-site-open-command-palette",
    "scene-documentation-site-destructive-confirmation-site-open-destructive-confirmation",
    "scene-documentation-site-local-history-site-open-local-history",
    "scene-documentation-site-changelog-viewer-site-open-changelog-viewer",
    "scene-documentation-site-external-editor-site-open-export-in-editor",
    "scene-documentation-site-exports-site-open-export-catalog",
    "scene-documentation-site-bulk-actions-site-select-bulk-range",
    "scene-documentation-site-accessibility-responsive-sizing-site-exercise-keyboard-focus",
    "scene-documentation-site-personal-vocabulary-upload-site-open-vocabulary-picker",
    "scene-documentation-site-toy-locks-authentication-site-activate-disabled-locked-element",
    "scene-documentation-site-unlock-ladder-site-start-unlock-ladder",
    "scene-documentation-site-shared-link-embed-site-inspect-shared-link-preview",
    "scene-documentation-site-adhd-modes-site-enable-focus-mode",
    "scene-documentation-site-browser-download-surfaces-site-confirm-captured-download",
    "scene-documentation-site-app-logo-customization-site-select-logo-preset",
    "scene-documentation-site-file-converter-site-open-converter-catalog",
    "scene-documentation-site-ollama-suite-manager-site-open-model-store",
    "scene-documentation-site-status-hub-site-open-status-hub",
    "scene-documentation-site-front-screen-provenance-site-observe-front-screen-provenance"
  ]
}
